{
  "schema_version": "new-account-text-1.0",
  "video_id": "v_aeab3bc4712a27c4",
  "account": "闲不住De宝",
  "input_mode": "text_only",
  "source_sha256": "ce5c4a657009993b626ee8aee359dace94f10d76aaf7346ba237d334e915d914",
  "started_at": "2026-10-16T04:46:47.326806+08:00",
  "finished_at": "2026-10-16T04:46:47.326806+08:00",
  "coverage": {
    "read_all_units": true,
    "unit_ids": [
      "v_aeab3bc4712a27c4_u001"
    ],
    "first_segment_id": "s000001",
    "last_segment_id": "s000150",
    "missing_ranges": []
  },
  "fields": {
    "theme": "文旅与地理风物探索：从德天瀑布到九寨沟，15个水做的仙境散落在中国各地。有的在沙",
    "category": "旅行地理/人文风光与生活方式",
    "story_points": [
      "叙事节点（s000001）：前两集咱们聊了呃几纳天池、盐湖这些这集直接亮底牌，",
      "叙事节点（s000026）：你往对面看，",
      "叙事节点（s000051）：你脱了鞋，",
      "叙事节点（s000076）：水花溅起来，",
      "叙事节点（s000101）：富含碳酸钙的水源，",
      "叙事节点（s000126）：加上水体洁净度极高，"
    ],
    "book_relations": [],
    "hook": {
      "present": true,
      "segment_id": "s000001",
      "quote": "前两集咱们聊了呃几纳天池、盐湖这些这集直接亮底牌，",
      "start_s": 0.07,
      "end_s": 7.29
    },
    "bridge": {
      "present": true,
      "segment_id": "s000026",
      "quote": "你往对面看，",
      "start_s": 71.26,
      "end_s": 72.265
    },
    "cta": {
      "present": true,
      "segment_id": "s000150",
      "quote": "我等你。",
      "start_s": 411.25,
      "end_s": 411.675
    },
    "reusable_method": "银发沉浸式体验：亲和老友口吻 + 极具诱惑力生活成本对比 + 高饱和度风光与奇特物产罗列 + 动员式出游情感召唤。",
    "original_topic_angles": [
      "结合《大美中国》图书与地理画册，将视频中触及的区域人文/山水风物提炼为原创深度图文与短片分镜",
      "结合《365日走遍中国》系列，制作面向银发与文化爱好者的历史名城生活与古建漫游指南"
    ]
  },
  "evidence": [
    {
      "segment_id": "s000001",
      "quote": "前两集咱们聊了呃几纳天池、盐湖这些这集直接亮底牌，",
      "supports": "fields.hook"
    },
    {
      "segment_id": "s000026",
      "quote": "你往对面看，",
      "supports": "fields.bridge"
    },
    {
      "segment_id": "s000150",
      "quote": "我等你。",
      "supports": "fields.cta"
    }
  ],
  "limitations": [
    "纯文本ASR分析，无视觉逐帧画面对应；专名未逐字人工听核",
    "无电商转化、带货销量或点击率指标，不可推断营销实际转化效果"
  ],
  "status": "AI_OK"
}